{
  "artifact_type": "EvidenceRadar_Evidence",
  "claims": [],
  "coverage": {
    "all_configured_sources_checked": true,
    "checked": [
      "acl_anthology",
      "arxiv",
      "europe_pmc",
      "formal_proceedings_or_publisher",
      "openalex",
      "openreview",
      "pmlr",
      "publisher",
      "pubmed"
    ],
    "checks": [
      {
        "checked_at": "2026-08-09T19:37:58.912310+09:00",
        "result_count": 0,
        "source_id": "acl_anthology",
        "stage": "discovery",
        "status": "NO_RESULTS",
        "summary": "22 configured query check(s); 0 provider result(s).",
        "url": "https://aclanthology.org/papers/index.xml"
      },
      {
        "checked_at": "2026-08-09T19:37:53.139949+09:00",
        "result_count": 589,
        "source_id": "arxiv",
        "stage": "discovery",
        "status": "SUCCESS",
        "summary": "22 configured query check(s); 589 provider result(s).",
        "url": "https://export.arxiv.org/api/query"
      },
      {
        "checked_at": "2026-08-09T19:36:10.672813+09:00",
        "result_count": 229,
        "source_id": "europe_pmc",
        "stage": "discovery",
        "status": "SUCCESS",
        "summary": "9 configured query check(s); 229 provider result(s).",
        "url": "https://www.ebi.ac.uk/europepmc/webservices/rest/search"
      },
      {
        "checked_at": "2026-08-09T19:35:50.536245+09:00",
        "notes": [
          "Publisher access target was 10-15; only 2 source pages were accessible.",
          "Publisher access stopped for blocked domains: alz-journals.onlinelibrary.wiley.com, bmjopen.bmj.com, onlinelibrary.wiley.com, www.tandfonline.com"
        ],
        "result_count": 2,
        "source_id": "formal_proceedings_or_publisher",
        "stage": "bounded_verification",
        "status": "FAILED",
        "summary": "Bounded verification attempted 15 page(s); 2 succeeded and 13 failed.",
        "url": "https://doi.org/"
      },
      {
        "checked_at": "2026-08-09T19:37:53.139943+09:00",
        "notes": [
          "OPENALEX_API_KEY is required for the OpenAlex discovery adapter",
          "Provider circuit open after an earlier check failed: OPENALEX_API_KEY is required for the OpenAlex discovery adapter"
        ],
        "result_count": 0,
        "source_id": "openalex",
        "stage": "discovery",
        "status": "FAILED",
        "summary": "22 configured query check(s); 0 provider result(s).",
        "url": "https://api.openalex.org/works"
      },
      {
        "checked_at": "2026-08-09T19:37:56.151375+09:00",
        "result_count": 0,
        "source_id": "openreview",
        "stage": "discovery",
        "status": "NO_RESULTS",
        "summary": "22 configured query check(s); 0 provider result(s).",
        "url": "https://api2.openreview.net/notes/search"
      },
      {
        "checked_at": "2026-08-09T19:37:58.913080+09:00",
        "result_count": 0,
        "source_id": "pmlr",
        "stage": "discovery",
        "status": "NO_RESULTS",
        "summary": "22 configured query check(s); 0 provider result(s).",
        "url": "https://proceedings.mlr.press/"
      },
      {
        "checked_at": "2026-08-09T19:35:50.536245+09:00",
        "notes": [
          "Publisher access target was 10-15; only 2 source pages were accessible.",
          "Publisher access stopped for blocked domains: alz-journals.onlinelibrary.wiley.com, bmjopen.bmj.com, onlinelibrary.wiley.com, www.tandfonline.com"
        ],
        "result_count": 2,
        "source_id": "publisher",
        "stage": "bounded_verification",
        "status": "FAILED",
        "summary": "Bounded verification attempted 15 page(s); 2 succeeded and 13 failed.",
        "url": "https://doi.org/"
      },
      {
        "checked_at": "2026-08-09T19:36:09.060705+09:00",
        "result_count": 255,
        "source_id": "pubmed",
        "stage": "discovery",
        "status": "SUCCESS",
        "summary": "9 configured query check(s); 255 provider result(s).",
        "url": "https://eutils.ncbi.nlm.nih.gov/entrez/eutils"
      }
    ],
    "notes": [
      "checked means a CHECK record was emitted; it does not mean the source succeeded.",
      "NO_RESULTS is a successful source check with zero matching records.",
      "GitHub Actions is an automated discovery/source-access lane; claim verification remains a ChatGPT Work or human-review task."
    ],
    "requested": [
      "acl_anthology",
      "arxiv",
      "europe_pmc",
      "formal_proceedings_or_publisher",
      "openalex",
      "openreview",
      "pmlr",
      "publisher",
      "pubmed"
    ],
    "requested_sources": [
      "acl_anthology",
      "arxiv",
      "europe_pmc",
      "formal_proceedings_or_publisher",
      "openalex",
      "openreview",
      "pmlr",
      "publisher",
      "pubmed"
    ],
    "searched": [
      "acl_anthology",
      "arxiv",
      "europe_pmc",
      "formal_proceedings_or_publisher",
      "openreview",
      "pmlr",
      "publisher",
      "pubmed"
    ],
    "searched_sources": [
      "acl_anthology",
      "arxiv",
      "europe_pmc",
      "formal_proceedings_or_publisher",
      "openreview",
      "pmlr",
      "publisher",
      "pubmed"
    ],
    "unavailable": [
      "formal_proceedings_or_publisher",
      "openalex",
      "publisher"
    ],
    "unavailable_sources": [
      "formal_proceedings_or_publisher",
      "openalex",
      "publisher"
    ]
  },
  "coverage_status": "SOURCE_ACCESS_GAP",
  "generated_at": "2026-08-09T19:38:17.003419+09:00",
  "notes": [
    "An empty claims ledger is intentional: metadata and snippets are not scientific conclusions."
  ],
  "run_id": "github-actions-20260809T193550+0900",
  "schema_version": "1.0",
  "sources": [
    {
      "access_status": "METADATA",
      "accessed_at": "2026-08-09T19:35:50.536245+09:00",
      "locator": "Bounded source landing page; automated access check only",
      "notes": [
        "No substantive claim was promoted without ChatGPT Work or human source review."
      ],
      "publisher": "Medicine",
      "source_id": "publisher-source-001",
      "source_type": "publisher",
      "title": "Effectiveness of acupuncture and related therapies for post-stroke insomnia: A systematic review and Bayesian network analysis.",
      "url": "https://www.ovid.com/jnls/md-journal/fulltext/10.1097/md.0000000000050081~effectiveness-of-acupuncture-and-related-therapies-for"
    },
    {
      "access_status": "METADATA",
      "accessed_at": "2026-08-09T19:35:50.536245+09:00",
      "locator": "Bounded source landing page; automated access check only",
      "notes": [
        "No substantive claim was promoted without ChatGPT Work or human source review."
      ],
      "publisher": "PloS one",
      "source_id": "publisher-source-002",
      "source_type": "publisher",
      "title": "Effectiveness of web-based educational videos on enhancing diabetes knowledge and empowerment among type 2 diabetes patients in primary care: A randomized controlled trial.",
      "url": "https://journals.plos.org/plosone/article?id=10.1371/journal.pone.0355192"
    }
  ],
  "works": [
    {
      "category": "clinical_medicine",
      "identifiers": {
        "doi": "10.1097/md.0000000000050081",
        "pmid": "42566606"
      },
      "limitations": [
        "Automated lane verified page access and event metadata, not the paper's substantive claims."
      ],
      "stream": "clinical_medicine",
      "title": "Effectiveness of acupuncture and related therapies for post-stroke insomnia: A systematic review and Bayesian network analysis.",
      "work_id": "doi:10.1097/md.0000000000050081"
    },
    {
      "category": "clinical_medicine",
      "identifiers": {
        "doi": "10.1371/journal.pone.0355192",
        "pmcid": "PMC13450740",
        "pmid": "42566360"
      },
      "limitations": [
        "Automated lane verified page access and event metadata, not the paper's substantive claims."
      ],
      "stream": "clinical_medicine",
      "title": "Effectiveness of web-based educational videos on enhancing diabetes knowledge and empowerment among type 2 diabetes patients in primary care: A randomized controlled trial.",
      "work_id": "doi:10.1371/journal.pone.0355192"
    }
  ]
}
