{
  "schema_version": "1.0",
  "artifact_type": "EvidenceRadar_Evidence",
  "generated_at": "2026-08-08T10:13:00+08:00",
  "run_id": "run-20260808-1013",
  "coverage_status": "COMPLETE",
  "coverage": {
    "requested": [
      "publisher"
    ],
    "checked": [
      "publisher"
    ],
    "searched": [
      "publisher"
    ],
    "unavailable": [],
    "all_configured_sources_checked": true,
    "checks": [
      {
        "source_id": "publisher",
        "stage": "bounded_verification",
        "status": "SUCCESS",
        "checked_at": "2026-08-08T10:08:00+08:00",
        "result_count": 1,
        "summary": "Example publisher source check completed.",
        "url": "https://example.org/article/2026.001"
      }
    ],
    "requested_sources": [
      "publisher"
    ],
    "searched_sources": [
      "publisher"
    ],
    "unavailable_sources": [],
    "notes": []
  },
  "sources": [
    {
      "source_id": "src-example-publisher",
      "url": "https://example.org/article/2026.001",
      "source_type": "publisher",
      "accessed_at": "2026-08-08T10:08:00+08:00",
      "access_status": "FULL_TEXT",
      "title": "Example study of a measurable outcome",
      "publisher": "Example Publisher",
      "locator": "Results > Table 1"
    }
  ],
  "works": [
    {
      "work_id": "doi:10.1234/example.2026.001",
      "title": "Example study of a measurable outcome",
      "category": "Clinical Medicine",
      "stream": "clinical_medicine",
      "identifiers": {
        "doi": "10.1234/example.2026.001"
      },
      "study_design": "Randomized controlled trial",
      "limitations": [
        "Example limitation recorded from the source."
      ]
    }
  ],
  "claims": [
    {
      "claim_id": "claim-example-001",
      "work_id": "doi:10.1234/example.2026.001",
      "status": "SUPPORTED",
      "claim_text": "The intervention changed the measured outcome relative to the comparison group.",
      "measurement": {
        "value": 2.4,
        "symbol": "MD",
        "unit": "points",
        "direction": "increase",
        "comparison_group": "control group"
      },
      "source_ids": [
        "src-example-publisher"
      ],
      "source_url": "https://example.org/article/2026.001",
      "locator": "Results > Table 1 > between-group difference",
      "supporting_quote": "Example source text supporting the claim.",
      "caveat": "Example evidence ledger entry; verify against the live source."
    }
  ],
  "notes": [
    "Example only; all claims require source-level verification in the live run."
  ]
}
